user,date,eval,star,votes,content
晚不安,2019-01-23,推荐,4,1,3.5。暂列追光最佳。一些少儿不宜的段落已经宣告了这部动画摆脱低幼向的决心（误。《白蛇：缘起》最终达到的，就是《风语咒》费尽心思想要达到的。虽然很大程度上依赖的是这个家喻户晓的故事，但对情怀的运用是恰到好处、画龙点睛的。爱情线的铺展以及剧情演进都很仓促，然而场景渲染和动作设计确实是业内标杆级的。第一个令我怔住的场面是宝青坊，简直有刘姥姥进大观园的感觉。结尾大战阵势不小，试图做出双高潮，但实际上有点冗长，解决问题缺乏合理性。整体细想，还是有佳句无佳章。
michaelchao_cc,2019-01-11,推荐,4,11,剧作上原版故事的许仙和白娘子的情被弱化，人妖法师之间的战斗被强化。这可能是由于故事创新的时候很难平衡情感与战斗，或者说战斗没有很好地融入情感，二者有一定分离。电影在制作定位方向偏向了游戏，运用了法宝、破阵等方式推进了剧情。动作设计中也借鉴了哈利波特、古剑奇谭中对决的元素。但是，总体来说，影片的完成度还不错，原作中白蛇、小青、许仙三个人的微妙关系在这部中得到了很好的保留，白蛇与许宣的相遇相恋也有及格水平的展现，没有过于拖沓的情节，法器的作用前后呼应，最后通过前世今生的牵绊过度到了西湖断桥边的相遇。推荐能接受白蛇传改编的人看。
唐小万,2019-01-14,还行,3,4,以情动人很勉强吧，被激情冲昏了头脑还差不多，只有最后的“彩蛋”，功劳还是《白蛇传》的。
陈矮,2019-01-11,还行,3,10,总觉得导演有什么不得了的见解要发表
一郁知秋,2019-01-11,力荐,5,23,"世间多的是两条腿的恶人，长了条尾巴又如何？！
不忘前世，共约今生。
中国的古代文化真的有太多值得拍的故事了。
"
一颗荔枝子,2019-01-13,很差,1,6,漫画版悲伤逆流成河
麻辣香水鱼,2019-01-20,推荐,4,4,值得一看，超喜欢，画面和感情线都好美的。
不见蝴蝶不见君,2019-01-12,力荐,5,22,爆炸好看啊，大家去支持下票房啊，颠覆的一版许仙宣，剧情没有那么完美但是绝对不薄弱，但是建议不要带孩子看，不合适。
坐好我要起飞啦,2019-01-15,较差,2,6,画面很美，配音老师辛苦。一星画面，一星配音。神仙剧情，随时都要谈恋爱。哪管那洪水滔天，天地八荒，三生三世，只为你一个回眸。牛笔！
没啥可说啦,2019-01-21,很差,1,9,编剧太偷懒了吧，剧情推进很是“理所当然”，明显剧本没有好好磨。真实给2.5星，一星只为去一下水分，别说什么严格不严格的，因为票价是向国外动画片看齐了，而质量就🙂……8分真的虚高了。
mysticark,2019-01-19,推荐,4,2,画面和音乐都做得非常不错。剧情上存在未解释清楚的地方，中期转折后的情节显得有些混乱。不过对于国产动画来说，这已是值得肯定的一部作品了。
○Ⅴ○,2019-01-12,力荐,5,7,前世的许仙透着一股迷人的侠气、目睹白蛇真身后痴心不改，不惜化妖；并且在每个副本中出心出力，很多时候起到了关键性作用。这个“许宣”强行篡改了今生许仙的人设，可是也弥补了许仙全部的不足，满足了观众对大男主的期待。至少我对这个改动相当满意。美术和画面也值得称赞，每帧都可以截成桌面。
Squidward,2019-01-20,还行,3,5,国产动漫真的太爱构建一个庞大的世界观 然后无可避免的不是顾此失彼就是解释不好 用大托小在我这不是很讨喜反正 被吹过头了 期望自然高 观感无可避免的差 口型有硬伤 蛇皮的材质也太闪太滑了 看到最后我的眼泪依旧不值钱
夜间飞行,2019-01-14,很差,1,4,李逍遥的造型适合任何古装片乃至…动画片
青青雫崎,2019-01-13,推荐,4,15,中國動畫片就得這麼拍，除了男女主的愛情動作戲有點突然，值得稱讚的是諸位配角，每個都活靈活現的⋯⋯
T.V.Zoe ி,2019-01-20,还行,3,4,故事没讲通 也就那样吧  挺花心思挺认真 但还是一股子我最讨厌的国产动画的网游味儿  女主是按着陶奕希捏的吧  男主是按着单眼皮金城武捏的吧 但这种差距就像「青城山下白素贞」一起 才觉得正版上线了
讽辞阿嘎,2019-01-11,力荐,5,17,"五百年前你叫小白
他叫许宣
缘起五百年
缘续五百年
前世今生
生生世世
今生你叫白素贞
他叫许官人
PS：中美合作，故事主线、画面风格超级出色。爱情、打斗、妖术、五行、萌宠、CP等元素全有了。
期待更多中国民间传说、神话故事焕发新光芒"
phoebe,2019-01-04,未打星,-1,4,画面意境完全没问题，但这个老套的故事……
turbine,2019-01-05,还行,3,8,总感觉宝青坊主小狐妖似曾相识，最终恍然大明白，三国杀董白！
parachute,2019-01-14,较差,2,17,尬死我了。
晓风明月,2019-01-15,还行,3,8,画面值得肯定，但是剧情是硬伤，配音也不行，太尬了，俗套，完全不能让我有代入感。这部电影很多方面都让我感觉有模仿泰坦尼克号，包括男女主身份地位差距大，包括男主性格还有最后男主保护女主的一幕，和泰坦尼克号太过类似，然而画虎不成反类犬，它不能像泰一样让我感动，只能说导演和剧本功力还差很多。而且男主这样的人设照理说会很吃香，可是整部电影看下来我只觉得男主是个傻X，时时刻刻都在装逼，越装逼越傻X。不过电影刚开始女主梦境的水墨风很让人惊喜。和心里预期差的有点多，看完明白了票房不行不是没有理由的，追光要是再不用心打磨剧本emmm，还有，可不可以请好一点的配音啊。最后，多给一星算是支持国产动漫电影吧。
张苑希,2019-01-21,还行,3,1,美术设计和视效场面的确精致唯美，但这种俗气的一见钟情网文式爱情实在让人吃不消，剧情薄弱节奏沉闷转折生硬，基本上可以当做白蛇传的前传看。ps.不管在任何有关白蛇的作品里青蛇对白蛇的感情才是最真挚的啊！
Camellias,2019-01-21,很差,1,6,爆米花电影，比变形金钢5还不如。一年都看不来几部烂片的我这次也算走眼了，被宣发忽悠进了影院。
乌鸦火堂,2019-01-20,推荐,4,2,追光动画最好的作品，其实也是被安利才看得，因为追光之前的作品全看了，对他们家有点灰心了，所以才刚看，还好终于起势了。画质不必多说，追光一贯的高品质，道具、场景设定是东方神韵，特效场面则是偏于西方。故事难得顺畅了一次，也很动人，结尾致敬断桥白娘子。台词一般，女角色人设都很好，男性角色相形见绌。许宣像胡歌，小白更像邱淑贞，小狐妖貌似圈粉无数
喵喵喵,2019-01-13,力荐,5,17,讲真，在结尾之前，应该是4星，但是片尾熟悉的音乐响起，泪又不争气流下来〒_〒，全场都一直坐着没人走……好吧居然有彩蛋……我还以为都是跟我一样听歌的……
在下李慕白,2019-01-11,力荐,5,23,“世上多的是两条腿的恶人，你多一条尾巴又怎样？” ，小时候看出的是其中的爱情，现在看来最打动的人的是其中困扰着无数人的身份认同了
WallE,2019-01-18,较差,2,11,捕，捕蛇者说？男主脸就是一般武侠剧男主的脸，女主脸就是网红脸，看一次忘一次。剧情乱七八糟，毫无逻辑可言，除了画面精致，优点乏善可陈，所谓成人电影不是女性裸露身体，说话吊嗓子就是成人电影。带着期待去，看到一半只想刷手机。
空山,2019-01-15,还行,3,5,"1.追光，仍然战斗在浪费团队和技术的第一线。发下毒誓，绝不做出好故事，谁先做出来谁TM是王八蛋。
2.前40分钟，精力主要用在对抗角色面瘫、眼神空洞、口型混乱、硅胶质感、漂浮不定所带来的不适。后一个小时的打戏真好看。师父的大锅饭练功法也有点意思。
3.确实成人向，裙子开叉到大腿根、衣衫撕破露出半圆乳房，还加了亲热戏。最可怕的是宝青坊老板娘，孩子身形，袒胸露腿，很不适啊！所有的性相关成人内容都令人不适。"
乌青,2019-01-19,较差,2,9,都2019年了还比不上1983年的《天书奇谭》十分之一水准。这弱智剧情，谈何国产惊喜？
噗,2019-01-20,较差,2,5,虚无的“中国古风”外壳与日本ACG亚文化杂交的怪胎，里面大量的星宿、八卦等常用的中华古典文化符号并不具备真正意义，只是用来填补动画空洞内涵好让其看起来是在弘扬深奥传统文化的遮羞布。一如片中人物说着矫揉造作的“古风”台词营造出的“古韵”，是虚假的、当代的、流行化的，如此看来便更加可恶了。人物与场景画风也不复早年国产动画的写意缥缈，受美国和日本动画以及网络游戏的影响极深，无论是主角们缺乏辨识度的“美型”人模、卖弄性感的萝莉童姥，还是“唯美”的高饱和场景建模都漫溢着塑料质感，以这样的美学去讲述最传统的中国故事是不可接受的。而在故事层面，也泯灭了中国动画最注重的含蓄美与留白，毫无铺垫且直白的情感表达和打怪升级般的游戏发展彻底损毁了这部动画的内核，廉价到无法使人感动。（对了，配音演员表现也很差劲）
recallair,2019-01-21,较差,2,7,"这片子有些无聊啊，剧本也弱，最大的问题：人物与环境缺乏互动，这就使得再美丽壮阔的环境想象也终究只是背景贴图而已。
不反对电影贩卖情怀，但首先你质量得要过硬啊，说句大实话，这片子技术上挺糙的，渲染缺乏细节，整体网游质感非常重。（还是国产网游，外国的网游CG做的可美了）"
贾小年,2019-01-19,推荐,4,1,开头和结尾太过惊艳，以至于可以忽略掉故事推进中的一些中二元素。（希望反派人物塑造可以更立体一点
birds,2019-01-17,还行,3,1,比之大圣强很多，视效很花，故事昏昏欲睡。
Yukip,2019-01-05,推荐,4,8,在国漫里水准算不错的，让我想到了去年的风语咒，其实算还可以的，多加一星支持一下! 
[已注销],2019-01-11,力荐,5,16,画面很精致，水墨风格极其唯美。人物性格鲜明通俗易懂，故事是白蛇传的前篇，相当于原创剧本。是一部值得推荐的好电影。
向简,2019-01-08,推荐,4,1,老故事已经板上钉钉，能发挥的并不多，角度好，在＂当年救了我＂的孔隙中凿出大情节。把许宣和白娘子写成了杨过和小龙女，致（借）敬（用）泰坦尼克号结尾的点睛之笔。千回百转让人怀念的永远是相遇和相爱阶段（前相处时代）。叙事并不输于花木兰和功夫熊猫之类，主流但不乏味，巧妙回答了＂美色在爱情中地位＂的天问，可以看作爱情寓言——因美色而起，凭痴心续航。髪簪是信物，记忆是信仰，梦是点题。人往往这样：初看美梦，觉得自己也行，于是自命不凡、嘲笑俗事；然后自己成了俗事，反过来笑美梦幼稚。成为俗事是必然，但分主动沦陷和被动沦陷；有的人弄潮很享受，有的人弄潮很被动；最惨的是不想弄也弄不好潮但只能被漩涡甩得七荤八素不人不鬼的人，这些人看到当初的美梦，除了内心一声惨叫，又能如何！呜呼！
海狸狸狸,2019-01-17,推荐,4,0,画面很美，特效很好，故事也很不错。果然是中美合拍，能看出来美国电影的影子啊，哈哈。并不是给小孩子看的动画片噢！最后还无缝衔接《新白娘子传奇》啊。
突然粉碎,2019-01-11,还行,3,7,迄今为止最好的追光动画盖章，白蛇传果然大IP，以为青白许仙的故事看得足够多了，实际上还有很大的开发空间，故事完成度和画面渲染都很满意，剧透预警：《冰雪奇缘》《泰坦尼克号》《新白娘子传奇》爱好者不要错过
萧玄清,2019-01-13,推荐,4,9,"7.5，我的马鸭，一个大老爷们硬是给我看哭了
人物形象还是太好莱坞了，男主没有记忆点，女主美得很普通，不过女配的脸我还是蛮喜欢的
情节很简单，不过切入点蛮不错的，期待下一部
故事里面有许多小心思和新意，挺不错
宝青坊最佳，期待番外篇
打斗凌厉，很帅很爽
道士难道只能跟鹤有关了吗？太死板了8
PS:记得带纸巾"
予己一书,2019-01-12,推荐,4,9,完爆大圣几条街。画面非常美，但是打斗跟开玩笑一样，蛇精boss跟国师没露面时感觉真牛批，但是还没干两下就趴了，跟漫威宇宙高潮打斗时一样闹着玩似的。本想打三星，但是结尾断桥遇许仙画面太美加一星。
SingLesinger,2019-01-19,推荐,4,0,结尾断桥二人背影的发型简直iconic，前面的叙事其实很普通，一些二次元的软色情元素国产动画中还是很少见。
JOJOORC/Z,2019-01-17,还行,3,3,是不容易，画面很棒，但故事和台词夸不了，人设也难受，卖肉卖得心酸。希望回本。
灼灼裴质,2019-01-17,推荐,4,2,剧本完成度很高。缺一星在于，我没有哭，也没有笑。
Favillae,2019-01-17,还行,3,5,反派国师师徒都是雷声大雨点小讲排场死得快，失望。剧情总体挺低幼的，小学生网文水准。
水怪,2019-01-20,还行,3,0,唐末屁民苦于抵税，然后就宋朝了…
Homo sapiens,2019-01-18,推荐,4,0,前半部分非常惊艳，一度想给五星。直到把人变妖有点开始不对劲，后面立即审美疲劳。总之，中美合拍两开花，可以一看！（
Lunar Chang,2019-01-24,力荐,5,0,一边看一边感叹中国动画效果现在都这么NB了吗？水墨写意中国元素都很和谐，重要的是自从“电影不能有鬼”以后，这是我见过招式最考究的中国鬼怪片了，那招金丝“天罗地网”飞出来千百只金仙鹤的时候，我也就在心里卧槽了100次吧。各种好不说了，就真诚的问一句，大家都魂飞魄散了，为什么小青没事？
胡姆胡姆库鲁库,2019-01-12,很差,1,4,垃圾垃圾垃圾垃圾！！！一股他妈的廉价国产剧风，白蛇长他妈个网红脸性格矫情的跟屎一样，我他妈第一次知道动画片能他妈尴尬成这样！！！恶心的死在电影院里！！！
一灯,2019-01-20,未打星,-1,0,没有什么好莱坞进入不了的了
何小辅,2019-01-14,力荐,5,6,不一样的白蛇传，以为是瞎改，最后居然能够和传统的白蛇传承接，惊喜
离桑,2019-01-15,推荐,4,0,8
流浪记,2019-01-25,还行,3,3,比大鱼好一些
盲忙,2019-01-12,还行,3,3,还不错的改编，想看徐克拍真人版。
安吉丽娜,2019-01-14,未打星,-1,12,还没看，就不打分了，澄清一个宣发上的误区，这部电影并不是中美合拍，制作者都是中国人，华纳只负责投资和提供了一些宏观指导，技术都是中国的，这个公司据说还做过小门神，质量都不错但都扑了，为了情怀做成人动画，这部据说是最后机会了，如果也扑了就要破产的样子，如果大家看了预告比较喜欢，但因为中美合拍比较膈应的，完全可以放下成见去看看。
HandWash,2019-01-13,推荐,4,6,结尾好加分呦
殇潮|Enigma,2019-01-20,还行,3,1,太成人了吧……人家还是个宝宝
党委书记,2019-01-11,还行,3,4,"比大圣归来强100倍确实。
但是，四连扑预定，追光顶住！不要倒闭！卫星吧需要你们，手动滑稽。"
梵目,2019-01-16,较差,2,7,动作戏有莫名其妙的逻辑性BUG，显得很假，故事具有连贯性，也有不少小高潮和冲突，能够提高可看性，但剧情上依旧比较老套，没有新意，可能成人化是最大的吸金噱头。
舒心酱,2019-01-11,还行,3,4,许宣是李逍遥性格，纯爱人设。打斗场面有些地方很失控，汪好可爱呦，奶萌奶萌的但那个大叔配音是怎么肥四
Rickest_Rick,2019-01-14,还行,3,4,不带情怀加成，不谈“支持国产“，那也不失为一部不错的动画电影
五星级大飞鱼,2019-01-17,力荐,5,4,给白蛇的团队 活下去的希望，国产的烂片都能给到五六亿的票房这个怎么就不行，喜欢凑烂片的同志们长点心吧。
陈四喜,2019-01-11,还行,3,6,故事一般般。感觉主角的情感基础铺垫的不够。师傅，师妹和国师多方势力捋的不顺。转折也比较突兀。小白变成巨蟒后，人物关系的走向就太简单了，很难把她再当做一个人物。阿宣选择做妖，是个败笔。因为人与妖的障碍就这么解决了，按理说留着这层障碍更好。
玥玲,2019-01-18,推荐,4,0,期望有第二部。
冰仔,2019-01-19,推荐,4,0,有几段动作有点僵，难得的是全片几乎都不尬，甚至有点感动。最重要的是，中美合拍的电影终于上映了！……开花，开花。(那狐妖也太少儿不宜了吧！)
phoebearbus,2019-01-19,还行,3,3,哪里好看了？！故事尬的没有那只狗都撑不下去（别扯什么技术画面）
-李庆宇-,2019-01-22,推荐,4,2,看完三句话记得特别清楚。人世间两条腿的恶人多了，长条尾巴怎么了；八荒四海总有我们的容身之处；来日方长来日方长来日方长。（都是在概率里偷生，哪有什么来日方长，我最不信来日方长 ）
dum没头脑,2019-01-17,力荐,5,0,有画面 有构思 有故事 对于每到放假无限循环看新白娘子传奇的我简直意义非凡
功夫兔子,2019-01-11,力荐,5,13,美极！美极！国漫巅峰！太美了！细腻唯美！光看画风就够了。另外这次我第一次观察了一下动画人物的口型。
万古,2019-01-08,力荐,5,14,唯一让我不满的地方就是那条单身狗，导演你是在暗示什么！？🙃
痞子老九,2019-01-20,推荐,4,0,鼓励性4星，画面与故事题材上的突破，都在国产动画电影里算得上亮眼。只是动作打斗方面显得太“快”了点，很多时候感觉是为了缩短时常而故意放快了，让人有点目不暇接……这一点，体验实在不咋滴～
gwei,2019-01-06,还行,3,4,前半部分，画面超美，后半部分 所有国产动画的通病！灰暗 凌乱！
Aboo,2019-01-13,推荐,4,2,既有船，也有船戏的《白蛇》前传，故事颇有当年王祖贤演的那些神神鬼鬼港片的风味，看着亲切。细节上也是有些小灵光的，比如佛像的眼泪不过只是解冻后的水汽。男主这个长相，我没猜错的话应该是唐人签约的艺人吧。鼓励鼓励，票房应该会随口碑走高，不过有点可惜不是农历蛇年。
yunduan,2019-01-13,力荐,5,5,国产动漫能有这样的水平确实难得，阿宣舍身救小白化身冰人的桥段有种泰坦尼克的感觉，结尾音乐响起，各种回忆……
BLAKE,2019-01-13,推荐,4,2,技术过硬，故事略微单薄了点，阿黄应该是最憋屈的配角了。
levitating,2019-01-15,还行,3,1,国产动画进步真是神速哇！最后大战睡着了，果然特效片的打斗戏一向是我的催眠剂。男主挂的时候，满脑子闪现泰坦尼克号……
超人叔叔,2019-01-16,还行,3,0,华纳摆在那里作画的品控没得说 作为缘起也算过关的前传故事了
岁月静好,2019-01-13,力荐,5,15,和我妈一起去看的，本来我妈说看大黄蜂不看动画片，我不干，我说为国产动漫崛起添砖加瓦！当真是没辜负我的期待！看完我妈也是非常满意，直呼太美了！等了小半年，从微博上看到预告片开始就在等着了！白蛇传是我们从小就熟悉的故事，但是和《大圣归来》对《西游记》的改编不同，《白蛇缘起》是《白蛇传》的前世故事，女孩子总是会喜欢这类前世今生情系三世的故事，剧本非常棒，特别唯美，结尾里面小白看着阿宣的魂魄清唱《何须问》的时候我真的哭了！
男娼起义,2019-01-16,还行,3,0,阎魔友情出演了
血天,2019-01-17,还行,3,6,节奏乱七八糟，爱情莫名其妙，我们好好铺垫不好吗。前半段再多点时间，把线理清楚，人物动机，情感好好铺垫，会好很多。以至于看到最后都觉得小白和阿宣的感情太过于仓促，师傅，小青的动机缺少点什么重要的推进因素。不过后半段倒挺好的，节奏比前半段好太多。很多设计看出来话了心思，比较亮眼。不过看完以后，很难记住有什么吸引人的地方了。
韧者,2019-01-09,推荐,4,7,"虽然好看，但比不上阿唐奇遇、小门神、猫与桃花源，故事太简单，除了爱情，没啥多余的内涵！看阿唐奇遇、小门神、猫与桃花源，能边看边思考，看白蛇不用带脑子（解读人性也说的过去，但没必要），适合放松看一看，不用带着鉴赏去看！
对了，里面的音乐值得鉴赏！"
Dita,2019-01-17,还行,3,0,"新白娘子传奇是童年回忆
青蛇是港片记忆
于是去看了部国产动画电影
上次看国产动画还是大圣归来
没有吹的那么神
也没有那么差吧
三星吧
画面确实不错
但是故事情节还是蛮突兀转折的
下面有剧透

最好笑的是许宣为了要和小白在一起
去变成了妖 长出了他狗狗的尾巴
我也是醉了
我以为我在看奇葩说呢
辩题是“伴侣变性了你怎么办”
当时就有个奇葩说 我建议你也去变个性[皱眉][皱眉][皱眉]
真的是爱上了妖 人妖不能一起 我建议你也去变成妖
这是什么沙雕操作😝😝😝
笑到昏Gucci

最后不止致敬了这两部🐍相关的经典作品
感觉还cos了泰坦尼克号哈哈哈哈哈
不行了 这一锅中美乱炖
我干不下去啊
不过确实原创内容太匮乏了
这种翻牌过各个版本的大ip还要拿来继续拍
看到结尾应该是不出意外还有下一部吧"
绯色_神仙,2019-01-13,还行,3,0,很多设定都挺有意思，特效不错。
影中世界,2019-01-19,推荐,4,0,真的很好看啊，制作精良，最主要的是画面真的很美，场景方面下了不少功夫。作为一个家喻户晓的国民IP，能够抛弃耳熟能详的许仙与白娘子的故事转而讲述两人前世缘起的故事就很有新意了，虽然爱情部分来得太突然，但是两人分别的时候还是被感动到了。结尾的歌一响，立刻又回到了那个熟悉的年代
夏日雨荷冬日娜,2019-01-14,力荐,5,1,《新白娘子传奇》中交代了5分钟不到的前世剧情，这里花了2个小时来讲，编剧脑洞还是开挺大的。剧终断桥上那一幕其实最百感交集，感觉也没有续集了，Sad。
一里独行,2019-01-09,力荐,5,14,当片尾曲响起，竟然有点想哭。白蛇不管是人还是蛇，造型都美到爆炸！国产动画的画面可以说是越来越漂亮了，剧情前半部分非常不错，后期决战有些混乱不过瑕不掩瑜，走出影厅就已经开始期待续作了，希望国产动画越来越好
秋熙,2019-01-16,未打星,-1,0,画风精致养眼，人物和动作设计也是可圈可点，但是剧情实在敷衍，完全是为了画面服务的，毫无逻辑可言，还不如做成mv得了。
眠去,2019-01-23,推荐,4,0,好喜欢哦，最惊艳是那个萝莉身的老狐狸，超酷啊！国产动画真是很难得了
咕噜咕噜吹泡泡,2019-01-15,推荐,4,2,故事情节特别流畅，各种中国元素以及人设都没毛病，看着白蛇传长大的我表示非常棒！！在票圈夸了一句，一个人说一看就是老外审美加国内网红审美，另一个说中美合拍文体两生花，是是是，人家华纳都承认了是合拍，到了国人眼里就都是他们美爹的功劳，魔障的人真够多的。好像现在喷国产是政治正确吗？？这样的作品不值得骄傲？？
黑特007,2019-01-17,还行,3,0,★★★☆，不是低幼向但kiss也太突兀了……人妖的本质是吸精机……半人半妖的蛇精是最好看的，配乐喜欢，尤其结尾转世太好看了，优缺参半
宅拾叁,2019-01-12,还行,3,2,追光一贯的老问题，大投资却把宣发作的非常烂。但质量还是有一定保障的，故事上还需要在打磨一下，尤其是反派的人物刻画。蛇村建模很美，就是人物网红锥子脸还没啥表情，唯一见到的就是开头的川字眉。裸背那一下满场家长捂小逼崽子们的眼睛，看之前不了解一下成人动画吗。
化熊出爪,2019-01-14,推荐,4,0,人设太disney类型化，你说白素贞是迪士尼公主毫无违和感、8.1 比海王还高迷醉、
夜潇狂,2019-01-16,推荐,4,0,新千年第一部PG-13级国产动画？
湛卢_读书,2019-01-12,推荐,4,6,"技术很强，故事太不圆润了。
被 ntr 即视感的青蛇和看起来是人但是弹跳能力惊人的许宣。
在调用观众情绪和情感方面还要多下功夫，很多桥段非常莫名其妙。打戏很多优点过满了。"
麦小白,2019-01-15,推荐,4,0,来世再续今生缘，让那情意永缠绵。/技术保持在线。
